{"run":100,"commit":"21a3aa4","metric":0,"metrics":{},"status":"crash","description":"Crash run: the benchmark aborted during the CMS reset/seed phase before Claude reached the MCP workflow, so no AX signal was gathered for the site-logo prompt. The failure appears to be an intermittent harness/setup issue around the remote D1 reset rather than an MCP UX regression.","timestamp":1774180625651,"segment":0,"confidence":null}
{"run":101,"commit":"21a3aa4","metric":1,"metrics":{},"status":"discard","description":"Baseline site-logo workflow exposed one remaining AX friction: the seeded singleton `site_settings` content model still lacks the `logo` media field that the bundled docs/schema describe, so Claude detoured into the built-in global site settings surface and used `faviconId` as a workaround. No code changes yet; recorded the baseline before aligning the bundled schema.","timestamp":1774180866050,"segment":0,"confidence":null}
{"run":102,"commit":"eecfcd2","metric":0,"metrics":{},"status":"keep","description":"Aligned the bundled blog seed with its documented site settings schema by adding a `logo` media field to the singleton `site_settings` content model. On the same site-logo workflow, friction_count improved from 1 to 0 because Claude could import the image and update the singleton record directly instead of detouring into the built-in global site settings surface and misusing `faviconId` as a workaround.","timestamp":1774181108822,"segment":0,"confidence":null}
{"run":103,"commit":"eecfcd2","metric":0,"metrics":{},"status":"discard","description":"Probe: category image update workflow is already friction-free enough in the current surface. Claude successfully found the Engineering category, imported an asset, attached it, and published the record without visible wheel-spinning, so no AX change is needed for this path.","timestamp":1774181362844,"segment":0,"confidence":null}
{"run":104,"commit":"eecfcd2","metric":1,"metrics":{},"status":"discard","description":"Baseline embedded-gallery workflow exposed one AX friction: the bundled blog docs/schema describe an `image_gallery` structured-text block, but the seeded live schema does not actually create that block type or allow it on `post.content`. Claude had to work around the request by putting the images in the top-level `gallery` field instead of embedding them in the body.","timestamp":1774181702926,"segment":0,"confidence":2}
{"run":105,"commit":"7e3cb4f","metric":0,"metrics":{},"status":"keep","description":"Aligned the live bundled blog seed with the documented structured-text surface by actually creating the `image_gallery` block type and allowing it on `post.content`. On the same embedded-gallery workflow, friction_count improved from 1 / success 0 to 0 / success 1 because Claude could embed a real gallery block in the body instead of falling back to the top-level `gallery` field.","timestamp":1774182002941,"segment":0,"confidence":2}
{"run":106,"commit":"7e3cb4f","metric":2,"metrics":{},"status":"discard","description":"Baseline richer hero-section workflow exposed two AX frictions: the bundled docs/schema imply `hero_section` supports `background_image`, `cta_text`, and `cta_url`, but the seeded live schema only has `headline` and `subheadline`. Claude could publish the post, but it had to drop the requested hero fields and explain the schema gap instead of completing the task.","timestamp":1774182337851,"segment":0,"confidence":null}
{"run":107,"commit":"ea3513e","metric":0,"metrics":{},"status":"keep","description":"Aligned the seeded `hero_section` block with the bundled docs/schema by adding `background_image`, `cta_text`, and `cta_url` fields. On the same richer hero-section workflow, friction_count improved from 2 / success 0 to 0 / success 1 because Claude could build the requested hero block exactly instead of dropping the background and CTA fields.","timestamp":1774182624227,"segment":0,"confidence":null}
{"run":108,"commit":"ea3513e","metric":2,"metrics":{},"status":"discard","description":"Baseline category-cover workflow exposed two AX frictions: the bundled docs/schema imply `category.cover_image` exists, but the seeded live category model still only has `name`, `slug`, `description`, `icon`, and `sort_order`. Claude could import the asset but then had to stop and ask whether to mutate the schema instead of completing the requested editorial update.","timestamp":1774182868382,"segment":0,"confidence":null}
{"run":109,"commit":"6cc501b","metric":0,"metrics":{},"status":"keep","description":"Aligned the seeded `category` model with the bundled docs/schema by adding the missing `cover_image` media field. On the same category-cover workflow, friction_count improved from 2 / success 0 to 0 / success 1 because Claude could import the asset, attach it to `cover_image`, publish the category, and finish without schema-mutation detours.","timestamp":1774183132005,"segment":0,"confidence":null}
{"run":110,"commit":"6cc501b","metric":0,"metrics":{},"status":"discard","description":"Probe: mixed singleton-plus-global site settings workflow is already friction-free. Claude correctly split the task across the content-model singleton (`tagline`) and the built-in global site settings surface (`fallbackSeoTitle`) without confusion.","timestamp":1774183377937,"segment":0,"confidence":null}
{"type":"config","name":"Harden admin MCP full-stack UX from empty CMS","metricName":"friction_count","metricUnit":"","bestDirection":"lower"}
{"run":111,"commit":"c1a89d9","metric":1,"metrics":{},"status":"discard","description":"Baseline admin MCP full-stack workflow from empty CMS hit one real friction point: Claude completed the task, but had to discover and work around an XML/tool-parameter encoding quirk where TypeScript generics in structured-text code blocks require escaping `<`/`>` as Unicode. No code changes yet; recording the baseline before hardening this path.","timestamp":1774184459906,"segment":1,"confidence":null}
{"run":112,"commit":"5a8d5db","metric":0,"metrics":{},"status":"keep","description":"Hardened the admin MCP guidance around XML-encoded tool arguments by documenting angle-bracket escaping (\\u003C/\\u003E) in build_structured_text and the agent guide. On the same empty-CMS blog-design workflow, friction_count improved from 1 to 0 because Claude no longer tripped over raw TypeScript generics inside code blocks and completed the full schema+content+publish flow cleanly.","timestamp":1774184764654,"segment":1,"confidence":null}
{"run":113,"commit":"5a8d5db","metric":0,"metrics":{},"status":"discard","description":"Probe: empty-CMS recipe-site workflow is already friction-free after the encoding guidance hardening. Claude designed the schema, linked ingredient records, created two recipes with structured-text steps, and published them cleanly, so there was no further improvement to keep on this path.","timestamp":1774185020463,"segment":1,"confidence":null}
{"run":114,"commit":"5a8d5db","metric":0,"metrics":{},"status":"discard","description":"Probe: event-schema workflow with slug_source, future-only date validation, venue linking, gallery setup, sample content creation, and publish was already friction-free. No further admin MCP hardening opportunity surfaced on this path.","timestamp":1774185145229,"segment":1,"confidence":null}
{"run":115,"commit":"5a8d5db","metric":0,"metrics":{},"status":"discard","description":"Probe: schema-ordering-heavy blog workflow with slug_source, block-type setup, author links, structured text using both hero_section and code_block, and publish was already friction-free. No new hardening target surfaced here.","timestamp":1774185321294,"segment":1,"confidence":null}
{"run":116,"commit":"5a8d5db","metric":0,"metrics":{},"status":"discard","description":"Probe: admin error-recovery flow for a dangling author link is already friction-free. Claude got the precise validation error, created the missing author, retried successfully, and published the corrected post without wheel-spinning.","timestamp":1774185457260,"segment":1,"confidence":null}
{"run":117,"commit":"5a8d5db","metric":0,"metrics":{},"status":"discard","description":"Probe: documentation-site workflow with schema design, linked categories, structured text with code_block support, sample content creation, publish, and schema export was already friction-free. No further admin MCP hardening target emerged on this path.","timestamp":1774185640820,"segment":1,"confidence":null}
{"run":118,"commit":"5a8d5db","metric":0,"metrics":{},"status":"discard","description":"Probe: restaurant CMS workflow with linked categories, five menu items, a singleton daily special, and publish operations was already friction-free. The current admin MCP guidance appears sufficient for this end-to-end path.","timestamp":1774185848474,"segment":1,"confidence":null}
{"run":119,"commit":"5a8d5db","metric":0,"metrics":{},"status":"discard","description":"Probe: portfolio-site workflow with technologies, cover images, structured text bodies, live URLs, linked records, and publish operations was already friction-free. No additional admin MCP hardening opportunity appeared here.","timestamp":1774186051026,"segment":1,"confidence":null}
{"run":120,"commit":"5a8d5db","metric":0,"metrics":{},"status":"discard","description":"Probe: nested structured-text schema-design workflow with recipe_step blocks containing nested ingredient_callout blocks was already friction-free. The current admin MCP guide/tooling appears sufficient even for bottom-up block composition.","timestamp":1774186241265,"segment":1,"confidence":null}
{"run":121,"commit":"5a8d5db","metric":0,"metrics":{},"status":"discard","description":"Probe: schema export/import plus create/publish/search workflow was already friction-free from an empty CMS. Claude designed the docs schema, worked with schema_io, created content, published it, and verified search without wheel-spinning, so there was no improvement to keep.","timestamp":1774186483543,"segment":1,"confidence":null}
{"type":"config","name":"Harden admin MCP localization, draft/publish, and translation-QA UX","metricName":"friction_count","metricUnit":"","bestDirection":"lower"}
{"run":122,"commit":"5a8d5db","metric":0,"metrics":{},"status":"discard","description":"Baseline localization workflow was already friction-free: from an empty CMS, Claude set up English/Icelandic localized fields, published English first, added Icelandic draft translations without changing shared fields, and completed a translation-drift QA pass cleanly. No improvement to keep on this path.","timestamp":1774186725766,"segment":2,"confidence":null}
{"run":123,"commit":"5a8d5db","metric":0,"metrics":{},"status":"discard","description":"Probe: localization drift QA workflow was already friction-free. Claude cleanly modeled locale fallback, published both locales, updated only English, and correctly reported Icelandic drift before re-publish without any MCP confusion.","timestamp":1774186881707,"segment":2,"confidence":null}
{"run":124,"commit":"5a8d5db","metric":0,"metrics":{},"status":"discard","description":"Probe: localized structured-text block-tree drift QA is already friction-free. Claude created localized hero/code_block content, introduced English-only structural changes, and reported precise cross-locale drift findings without tool confusion.","timestamp":1774187193924,"segment":2,"confidence":null}
{"run":125,"commit":"5a8d5db","metric":0,"metrics":{},"status":"discard","description":"Probe: allLocalesRequired localization validation and recovery workflow was already friction-free. Claude correctly hit the publish-time validation, explained it, filled the missing Icelandic fields, and published successfully without wheel-spinning.","timestamp":1774187335303,"segment":2,"confidence":null}
{"type":"config","name":"Harden MCP server agent experience","metricName":"friction_count","metricUnit":"","bestDirection":"lower"}
{"run":126,"commit":"5a8d5db","metric":0,"metrics":{},"status":"discard","description":"Baseline probe: empty-CMS markdown structured_text flow with an embedded image_block, external link, publish, and GraphQL verification was already friction-free. No hardening target surfaced on this path.","timestamp":1774371755625,"segment":3,"confidence":null}
{"run":127,"commit":"5a8d5db","metric":0,"metrics":{},"status":"discard","description":"Probe: empty-CMS draft preview workflow with canonicalPathTemplate, preview token verification, publish, and public GraphQL verification was already friction-free. No MCP hardening opportunity surfaced here.","timestamp":1774371924324,"segment":3,"confidence":null}
{"run":128,"commit":"5a8d5db","metric":0,"metrics":{},"status":"discard","description":"Probe: canonical {markdown, blocks-map} structured_text authoring from an empty CMS was already friction-free. The agent used the sentinel and keyed block map correctly, then verified the rendered DAST via GraphQL.","timestamp":1774372087503,"segment":3,"confidence":null}
{"run":129,"commit":"5a8d5db","metric":0,"metrics":{},"status":"discard","description":"Probe: markdown-mode structured_text creation plus markdown-mode prose update from an empty CMS was already friction-free. The agent avoided hand-built DAST, preserved the embedded block, re-published, and verified the updated link and typo fix via GraphQL.","timestamp":1774372297398,"segment":3,"confidence":null}
{"run":130,"commit":"5a8d5db","metric":0,"metrics":{},"status":"discard","description":"Probe: inline itemLink structured_text authoring from an empty CMS was already friction-free. The agent created the author first, embedded the record link correctly in markdown, published both records, and verified the itemLink node via GraphQL.","timestamp":1774372435432,"segment":3,"confidence":null}
{"run":131,"commit":"5a8d5db","metric":1,"metrics":{},"status":"discard","description":"Baseline patch_blocks workflow exposed one real MCP friction: when create_record uses custom structured-text block ids, the draft record's `blocks` map can be empty even though the published snapshot has the blocks. Claude had to work around this by re-writing the document with update_record before patch_blocks would accept the block IDs.","timestamp":1774372790159,"segment":3,"confidence":null}
{"run":132,"commit":"5a8d5db","metric":1,"metrics":{},"status":"discard","description":"Tried clarifying in the create_record/patch_blocks docs that custom block IDs stay stable and that patch_blocks returns a compact summary, not the full record. The exact block-edit benchmark stayed at friction_count 1: Claude still spent time around the same patch_blocks misunderstanding, although the run clarified that the suspected draft-state bug is not reproduced locally and the real confusion may be response-shape related.","timestamp":1774373645839,"segment":3,"confidence":null}
{"run":133,"commit":"a583d72","metric":0,"metrics":{},"status":"keep","description":"Hardened the patch_blocks editing flow for structured-text-heavy MCP sessions. The compiler now preserves optional null-valued block fields during patch rewrites (so caption-only patches no longer fail when sibling media fields are null), patch_blocks responses now include the patched field envelope alongside the compact summary, and the guide/tool docs now more explicitly distinguish workspace reads from final GraphQL/live verification. Added regression coverage for null block-field patching and the richer MCP patch_blocks response. On the same publish→patch_blocks→publish→verify workflow, friction_count improved from 1 to 0.","timestamp":1774375398779,"segment":3,"confidence":null}
{"run":134,"commit":"a583d72","metric":0,"metrics":{},"status":"discard","description":"Probe: mixed markdown-authoring → patch_blocks → markdown-prose-rewrite workflow from an empty CMS was already friction-free. The agent used the intended tool split cleanly and verified the final live result via GraphQL.","timestamp":1774375736956,"segment":3,"confidence":null}
{"run":135,"commit":"a583d72","metric":0,"metrics":{},"status":"discard","description":"Probe: canonical _type array block format in {markdown, blocks} was already friction-free from an empty CMS. The agent used the sentinel and array entry shape correctly, then verified the rendered structured_text via GraphQL.","timestamp":1774375870267,"segment":3,"confidence":null}
{"run":136,"commit":"a583d72","metric":0,"metrics":{},"status":"discard","description":"Probe: large markdown-mode structured_text create+rewrite workflow with 10+ paragraphs and embedded blocks was already friction-free. The agent stayed in markdown mode, preserved both blocks, and verified the final live result via GraphQL.","timestamp":1774376221725,"segment":3,"confidence":null}
{"run":137,"commit":"a583d72","metric":0,"metrics":{},"status":"discard","description":"Probe: multi-draft preview URL workflow from an empty CMS was already friction-free. The agent refreshed the preview token after updating the title, kept the slug-stable preview path, published, and verified the final title via GraphQL.","timestamp":1774376364036,"segment":3,"confidence":null}
{"run":138,"commit":"a583d72","metric":0,"metrics":{},"status":"discard","description":"Probe: deeply nested structured_text patch_blocks workflow from an empty CMS was already friction-free. The agent patched a nested feature_card, deleted the nested code_block, re-published, and verified the final live block tree via GraphQL.","timestamp":1774376678147,"segment":3,"confidence":null}
{"run":139,"commit":"a583d72","metric":0,"metrics":{},"status":"discard","description":"Probe: markdown inline-formatting and numbered-list round-trip from an empty CMS was already friction-free. The agent created the post in markdown mode and verified the expected DAST marks, link node, and list structure via GraphQL.","timestamp":1774376809294,"segment":3,"confidence":null}
{"run":140,"commit":"a583d72","metric":0,"metrics":{},"status":"discard","description":"Probe: canonical {value, blocks-map} structured_text round-trip update from an empty CMS was already friction-free. The agent read back the CMS-generated envelope, edited the canonical block map directly, published, and verified the live result via GraphQL.","timestamp":1774377122604,"segment":3,"confidence":null}
{"run":141,"commit":"a583d72","metric":0,"metrics":{},"status":"discard","description":"Probe: combined inline itemLink + draft preview + publish verification workflow from an empty CMS was already friction-free. The agent created the author first, used markdown record-link syntax correctly, verified the draft via preview token, then published and re-verified publicly via GraphQL.","timestamp":1774377448644,"segment":3,"confidence":null}
{"run":142,"commit":"a583d72","metric":0,"metrics":{},"status":"discard","description":"Probe: publish-and-verify-on-live-site workflow from an empty CMS was already friction-free. The agent used the canonical public URL, fetched the rendered page itself, and confirmed the published title/body without substituting MCP workspace reads.","timestamp":1774378001210,"segment":3,"confidence":null}
{"run":143,"commit":"a583d72","metric":1,"metrics":{},"status":"discard","description":"Discarded this preview-site verification probe because the measured friction came from the Astro frontend being wired to an older schema/query shape, not from the MCP server UX itself. The agent had to update and redeploy the site to render the newly designed schema, so the friction_count 1 here is benchmark contamination rather than an MCP hardening opportunity.","timestamp":1774378639502,"segment":3,"confidence":null}
{"run":144,"commit":"a583d72","metric":0,"metrics":{},"status":"discard","description":"Probe: complex prose + external link + inline record link + embedded code block authoring from an empty CMS was already friction-free. The agent discovered the right structured_text shape and verified the final live DAST via GraphQL.","timestamp":1774378906840,"segment":3,"confidence":null}
{"run":145,"commit":"a583d72","metric":0,"metrics":{},"status":"crash","description":"Crash probe: simple preview-URL-on-live-site workflow timed out before producing a benchmark verdict, so no MCP UX signal was gathered. This looks like harness/runtime instability rather than an actionable server-surface regression.","timestamp":1774379523109,"segment":3,"confidence":null}
{"run":146,"commit":"a583d72","metric":0,"metrics":{},"status":"discard","description":"Probe: admin scheduling workflow from an empty CMS was operationally friction-free. The agent created a draft, scheduled publication, cleared the schedule, published immediately, and confirmed the published state cleanly.","timestamp":1774379664933,"segment":3,"confidence":null}
{"run":147,"commit":"a583d72","metric":0,"metrics":{},"status":"discard","description":"Probe: localized markdown-mode structured_text authoring from an empty CMS was already friction-free. The agent created English and Icelandic localized bodies, published them, and verified both live localized DAST trees via GraphQL.","timestamp":1774379822971,"segment":3,"confidence":null}
{"run":148,"commit":"a583d72","metric":0,"metrics":{},"status":"crash","description":"Crash probe: richer preview-URL-on-live-site workflow timed out before producing a benchmark verdict, so it did not generate usable MCP UX signal. This again looks like harness/runtime instability around the live-site preview fetch path rather than an actionable MCP server regression.","timestamp":1774380461139,"segment":3,"confidence":null}
