{"run":149,"commit":"bd77e2c","metric":0,"metrics":{},"status":"keep","description":"Clarified in the structured_text create_record docs and guide that `{markdown, blocks}` persists the initial block payload in the same create/update call, and that `patch_blocks` is only for later targeted edits. On the same docs+authors workflow with markdown prose, inline record links, inline formatting, numbered lists, and an embedded TypeScript generic code_snippet block, friction_count improved from 1 to 0 because Claude no longer invented a follow-up patch_blocks round-trip to make the block data stick.","timestamp":1774381066659,"segment":3,"confidence":null}
{"run":150,"commit":"bd77e2c","metric":0,"metrics":{},"status":"discard","description":"Probe: schema design + linked records + GraphQL-first verification from an empty CMS was already friction-free. The agent followed the instruction to use GraphQL for the final verification step rather than substituting MCP workspace reads.","timestamp":1774381322972,"segment":3,"confidence":null}
{"run":151,"commit":"a583d72","metric":0,"metrics":{},"status":"checks_failed","description":"Found a real admin MCP bug: get_record was returning raw structured_text DAST without materialized `blocks`, which made agents think `{markdown, blocks}` had failed to persist inline block payloads and drove a bogus patch_blocks workaround. Fixed get_record to materialize structured_text fields and clarified the docs that initial block payloads are persisted inline. The benchmark improved from friction_count 1 to 0, but checks failed because test/structured-text.test.ts still expected the old raw-DAT get_record shape and needs updating to the materialized envelope.","timestamp":1774381762905,"segment":3,"confidence":null}
