{"run":44,"commit":"2fe36cc","metric":3,"metrics":{},"status":"discard","description":"Tried strengthening the guide's schema-first and nested-mount script guidance for Node.js MCP scripts, but the benchmark got worse (friction_count 2 → 3). Claude still spent turns on auth/bootstrap and initialize behavior, so this wording change did not help.","timestamp":1774122550197,"segment":0,"confidence":null}
{"run":45,"commit":"d98cd57","metric":0,"metrics":{},"status":"keep","description":"Added compare_record_versions to the editor MCP so agents can diff a stored version against another version or the current published snapshot in one call. On the same version-diff workflow, friction_count improved from 1 to 0 because Claude no longer had to reconstruct the comparison from version history plus publish responses.","timestamp":1774123274154,"segment":0,"confidence":null}
{"run":46,"commit":"d98cd57","metric":2,"metrics":{},"status":"discard","description":"Tried enriching search_content results with titles plus stronger search guidance. The exact same seeded-title lookup stayed at friction_count 2 because the real issue is duplicate seeded benchmark posts in the deployment, not missing title metadata in search results.","timestamp":1774124049876,"segment":0,"confidence":null}
{"run":47,"commit":"d98cd57","metric":0,"metrics":{},"status":"discard","description":"Probe: updating existing scalar post fields (reading_time, featured) is already friction-free. No change needed.","timestamp":1774124303228,"segment":0,"confidence":null}
{"run":48,"commit":"d98cd57","metric":0,"metrics":{},"status":"discard","description":"Probe: asset replacement while preserving references is already friction-free. No change needed.","timestamp":1774124578087,"segment":0,"confidence":null}
{"run":49,"commit":"d98cd57","metric":0,"metrics":{},"status":"discard","description":"Probe: invalid media references already fail fast with a precise ValidationError at create_record time. No change needed.","timestamp":1774124802473,"segment":0,"confidence":null}
{"run":50,"commit":"d98cd57","metric":0,"metrics":{},"status":"discard","description":"Probe: undoing the last published change via version history and restore_record_version is already friction-free. No change needed.","timestamp":1774125041792,"segment":0,"confidence":null}
{"run":51,"commit":"7bca75b","metric":2,"metrics":{},"status":"keep","description":"Added a concrete raw-HTTP bulk curl example to the guide, including nested mount-point guidance, direct tools/call usage without assuming initialize, JSON result extraction, and the minimal bulk_create_records -> bulk_publish_records sequence. On the same curl-script benchmark, friction_count improved from 3 to 2 because Claude stopped speculating about the handshake and chose the two-call bulk path directly.","timestamp":1774125644648,"segment":0,"confidence":null}
{"run":52,"commit":"7bca75b","metric":0,"metrics":{},"status":"discard","description":"Probe: editor/admin schema-mutation boundary is already friction-free. Claude correctly determined from the guide and visible tool list that schema tools are absent on /mcp/editor rather than runtime-rejected.","timestamp":1774125881664,"segment":0,"confidence":null}
{"run":53,"commit":"7bca75b","metric":4,"metrics":{},"status":"discard","description":"Tried stronger schema-first wording for script authors, but the exact Node.js script benchmark got worse (2 -> 4). Claude spent extra turns doing schema_info and still had uncertainty around tool result shapes, so this wording overcorrected without reducing real friction.","timestamp":1774126438314,"segment":0,"confidence":null}
{"run":54,"commit":"7bca75b","metric":3,"metrics":{},"status":"discard","description":"Tried clarifying in the guide that asset tools return a top-level id to use directly, but the exact Node.js script benchmark still got worse (2 -> 3). The remaining friction is broader script synthesis uncertainty, not just import_asset_from_url response shape.","timestamp":1774126790067,"segment":0,"confidence":null}
{"run":55,"commit":"7bca75b","metric":0,"metrics":{},"status":"discard","description":"Probe: creating and publishing a post that exercises nearly all seeded post field types is already friction-free. No change needed.","timestamp":1774127057385,"segment":0,"confidence":null}
{"run":56,"commit":"7bca75b","metric":0,"metrics":{},"status":"discard","description":"Probe: taxonomy reorganization via create_record + update_record + publish_record is already friction-free. No change needed.","timestamp":1774127307102,"segment":0,"confidence":null}
{"run":57,"commit":"77d3a29","metric":0,"metrics":{},"status":"keep","description":"Added titles to search_content results (and documented that title is included when available), so agents can report exact matching records directly instead of inferring titles from snippets or slugs. On the same cross-content search workflow, friction_count improved from 1 to 0.","timestamp":1774127872928,"segment":0,"confidence":null}
{"run":58,"commit":"b6595c8","metric":0,"metrics":{},"status":"keep","description":"Added get_record to the editor MCP so agents can fetch one full materialized record by id after search_content instead of scanning all records with query_records. On the same structured-text patch workflow, friction_count improved from 1 to 0 because Claude could inspect the target record directly before calling patch_blocks.","timestamp":1774128690688,"segment":0,"confidence":null}
{"run":59,"commit":"b6595c8","metric":0,"metrics":{},"status":"discard","description":"Probe: draft-vs-published preview via update_record response plus _published_snapshot is already friction-free. No change needed.","timestamp":1774128948765,"segment":0,"confidence":null}
{"run":60,"commit":"b6595c8","metric":0,"metrics":{},"status":"discard","description":"Probe: long-form markdown-to-structured_text authoring is already friction-free. No change needed.","timestamp":1774129284110,"segment":0,"confidence":null}
{"run":61,"commit":"296d394","metric":0,"metrics":{},"status":"keep","description":"Added concrete nested structured-text guidance for the blog seed's feature_grid -> feature_card -> details flow, plus a get_record hint for inspecting one record before patching nested content. On the same deep nested inline-link workflow, friction_count improved from 1 / success 0 to 0 / success 1.","timestamp":1774130455985,"segment":0,"confidence":null}
{"run":62,"commit":"296d394","metric":0,"metrics":{},"status":"discard","description":"Probe: full multi-step Effect TypeScript post creation is operationally friction-free. The run was marked success=0 only because Claude's final prose omitted explicit mention of the excerpt, not because the MCP surface caused confusion or extra turns.","timestamp":1774130769036,"segment":0,"confidence":null}
{"run":63,"commit":"296d394","metric":0,"metrics":{},"status":"discard","description":"Probe: invalid structured_text block types already fail fast with a precise allowlist ValidationError. No change needed.","timestamp":1774131034040,"segment":0,"confidence":null}
{"run":64,"commit":"296d394","metric":0,"metrics":{},"status":"discard","description":"Probe: publish/unpublish lifecycle plus final status verification via query_records is already friction-free. No change needed.","timestamp":1774131283454,"segment":0,"confidence":null}
{"run":65,"commit":"296d394","metric":2,"metrics":{},"status":"discard","description":"Tried adding a small bundled-blog schema cheat sheet to the guide so script authors would stop guessing post/cover_image names. It helped Claude stop guessing and restored success=1 on the Node.js script prompt, but friction_count stayed flat at 2, so this did not improve the primary metric.","timestamp":1774131591275,"segment":0,"confidence":null}
{"run":66,"commit":"296d394","metric":2,"metrics":{},"status":"discard","description":"Tried clarifying that create_record/update_record use arguments.data rather than arguments.fields in raw HTTP scripts. The Node.js script benchmark still stayed at friction_count 2, so this wasn't the main remaining bottleneck.","timestamp":1774131919478,"segment":0,"confidence":null}
{"run":67,"commit":"88cf028","metric":0,"metrics":{},"status":"keep","description":"Added write-time validation for date and date_time fields using ISO format schemas, plus regression tests. On the same invalid-date workflow, friction_count improved from 1 to 0 because the CMS now rejects bad date strings immediately with a precise ValidationError instead of silently publishing invalid data.","timestamp":1774132526704,"segment":0,"confidence":null}
{"run":68,"commit":"88cf028","metric":0,"metrics":{},"status":"discard","description":"Probe: asset import plus alt/title metadata enrichment is already friction-free. The MCP surface supports alt/title both on import_asset_from_url and as field-level media overrides.","timestamp":1774133015928,"segment":0,"confidence":null}
{"run":69,"commit":"bc1e47c","metric":1,"metrics":{},"status":"keep","description":"Corrected the raw-HTTP docs for bulk_create_records to match reality: it returns {created, records}, and script authors should extract ids from .records[].id. On the same curl-script benchmark, friction_count improved from 3 to 1 because Claude no longer had to guess the bulk response shape and produced a more reliable two-call script.","timestamp":1774133823111,"segment":0,"confidence":null}
{"run":70,"commit":"bc1e47c","metric":1,"metrics":{},"status":"discard","description":"Tried adding a bundled-blog schema cheat sheet to the guide to remove the last schema-discovery detour in the curl-script workflow. The exact benchmark stayed at friction_count 1, so the remaining friction is now mostly inherent endpoint/auth inference outside the MCP surface.","timestamp":1774134127187,"segment":0,"confidence":null}
{"run":71,"commit":"bc1e47c","metric":0,"metrics":{},"status":"discard","description":"Probe: importing an asset with alt/title metadata in one call is already friction-free because import_asset_from_url accepts alt and title directly.","timestamp":1774134602105,"segment":0,"confidence":null}
{"run":72,"commit":"bc1e47c","metric":0,"metrics":{},"status":"discard","description":"Probe: updating asset metadata after import is already friction-free via replace_asset while keeping the same asset id. No separate MCP tool is currently needed for this workflow.","timestamp":1774134606046,"segment":0,"confidence":null}
{"run":73,"commit":"bc1e47c","metric":0,"metrics":{},"status":"discard","description":"Probe: record duplication via search_content + get_record + create_record is already friction-free. No dedicated duplicate_record tool is needed for this workflow right now.","timestamp":1774134885728,"segment":0,"confidence":null}
{"run":74,"commit":"bc1e47c","metric":0,"metrics":{},"status":"discard","description":"Probe: boolean field values are still not validated at write time (`featured: \"maybe\"` was accepted), but this specific benchmark still scored friction_count 0 because Claude reported the behavior precisely. Logged as a promising follow-up rather than a keep.","timestamp":1774135125507,"segment":0,"confidence":null}
{"run":75,"commit":"bc1e47c","metric":0,"metrics":{},"status":"discard","description":"Probe: invalid publish schedule datetimes already fail fast with a clear ValidationError. No change needed.","timestamp":1774135358867,"segment":0,"confidence":null}
{"run":76,"commit":"bc1e47c","metric":0,"metrics":{},"status":"discard","description":"Probe: nested feature_grid -> feature_card -> details content with both inline links and nested code_block blocks is now friction-free after the nested structured-text guidance improvements.","timestamp":1774135857044,"segment":0,"confidence":null}
{"run":77,"commit":"bc1e47c","metric":0,"metrics":{},"status":"discard","description":"Probe: locating and updating a category record is already friction-free. No query/filtering improvements were needed for this workflow.","timestamp":1774136093407,"segment":0,"confidence":null}
{"run":78,"commit":"bc1e47c","metric":2,"metrics":{},"status":"discard","description":"Tried adding a minimal Node.js extraction hint for parsing result.content[0].text, but the exact Node script benchmark stayed at friction_count 2 and success regressed. The remaining script friction is broader than just JSON parsing.","timestamp":1774136682511,"segment":0,"confidence":null}
{"run":79,"commit":"348909a","metric":0,"metrics":{},"status":"keep","description":"Added write-time validation for boolean, integer, and float fields via the field-type registry, plus regression tests. On the same reading_time recovery workflow, friction_count improved from 1 to 0 because the CMS now rejects invalid scalar strings immediately and Claude can correct the value instead of silently publishing bad data.","timestamp":1774137823459,"segment":0,"confidence":null}
{"run":80,"commit":"348909a","metric":1,"metrics":{},"status":"checks_failed","description":"Tried normalizing boolean field values in returned record payloads so MCP responses use true/false instead of SQLite 1/0. The benchmark stayed at friction_count 1 and backpressure checks caught a TypeScript error in the helper, so this iteration was auto-reverted.","timestamp":1774138715898,"segment":0,"confidence":null}
{"run":81,"commit":"348909a","metric":1,"metrics":{},"status":"discard","description":"Added validation for dangling seo.image asset ids on create/update, but the same recovery benchmark stayed at friction_count 1 because Claude still had to do the recovery path: import a real image, retry create_record, then publish. The data integrity fix is real, but it did not reduce the primary metric on this prompt.","timestamp":1774139353633,"segment":0,"confidence":null}
{"run":82,"commit":"348909a","metric":0,"metrics":{},"status":"discard","description":"Probe: cross-content full-text search reporting top matches is already friction-free now that search_content includes titles.","timestamp":1774139928099,"segment":0,"confidence":null}
{"run":83,"commit":"e7bc82f","metric":2,"metrics":{},"status":"keep","description":"Added a concrete minimal Node.js single-record flow to the raw-HTTP guide, showing import_asset_from_url -> create_record(data) -> publish_record plus the crucial single-record payload.id extraction rule. On the same Node.js script benchmark, friction_count improved from 3 to 2 because Claude stopped inventing the wrong request shape and followed the single-record flow more directly.","timestamp":1774140243715,"segment":0,"confidence":null}
{"run":84,"commit":"e7bc82f","metric":3,"metrics":{},"status":"discard","description":"Tried adding an explicit note that endpoint URL and bearer tokens are not discoverable from MCP and must be reused from existing client config. On the same Node.js script benchmark, friction_count got worse (2 -> 3), so this wording did not help script synthesis.","timestamp":1774140581852,"segment":0,"confidence":null}
{"run":85,"commit":"0d82101","metric":0,"metrics":{},"status":"keep","description":"Normalized boolean fields in MCP record responses so create/get/update/publish flows return true/false instead of SQLite 1/0. On the same boolean recovery workflow, friction_count improved from 1 to 0 because Claude could report featured=true directly after correcting the invalid value.","timestamp":1774141056324,"segment":0,"confidence":null}
{"run":86,"commit":"0d82101","metric":3,"metrics":{},"status":"discard","description":"Tried making create_record/update_record tool descriptions explicitly call out the top-level data shape to help raw HTTP script authors, but the exact Node.js script benchmark got worse (2 -> 3). This wording did not reduce the remaining script friction.","timestamp":1774141358347,"segment":0,"confidence":null}
{"run":87,"commit":"0d82101","metric":0,"metrics":{},"status":"discard","description":"Probe: editor/admin schema-mutation boundary remains friction-free. No change needed.","timestamp":1774141597790,"segment":0,"confidence":null}
{"run":88,"commit":"0d82101","metric":0,"metrics":{},"status":"discard","description":"Probe: another nested structured_text combination (hero_section + feature_grid + nested details link/code) is already friction-free after the structured-text guidance improvements.","timestamp":1774141890747,"segment":0,"confidence":null}
{"run":89,"commit":"4d91914","metric":0,"metrics":{},"status":"keep","description":"Improved edge-case error quality for non-localized fields by detecting locale-keyed objects before schema decoding and returning a precise ValidationError that the field is not localized. On the same localized-payload prompt, friction_count improved from 1 to 0.","timestamp":1774142751780,"segment":0,"confidence":null}
{"run":90,"commit":"3b78cc7","metric":0,"metrics":{},"status":"keep","description":"Validated seo.image asset references the same way media/media_gallery references are validated, covering create and update paths. On the same nonexistent seo_field.image prompt, friction_count improved from 1 to 0 because the CMS now returns a precise ValidationError instead of silently storing a bogus asset ID.","timestamp":1774143476513,"segment":0,"confidence":null}
{"run":91,"commit":"3b78cc7","metric":0,"metrics":{},"status":"discard","description":"Probe: raw HTTP curl workflow that had to confirm category/post field names and link shape via the MCP surface was already friction-free. No change needed.","timestamp":1774143751493,"segment":0,"confidence":null}
{"run":92,"commit":"67b8516","metric":0,"metrics":{},"status":"keep","description":"Improved media-field error quality for a common wrong object shape by detecting {id: ...} and returning a schema-aware ValidationError that explains the correct forms (asset ID string or {upload_id: ...}). On the same wrong-media-shape prompt, friction_count improved from 3 to 0.","timestamp":1774144345300,"segment":0,"confidence":null}
{"run":93,"commit":"67b8516","metric":0,"metrics":{},"status":"discard","description":"Probe: wrong media_gallery object shape ({id: ...}) is already handled clearly enough in the current surface. No further change needed.","timestamp":1774144563750,"segment":0,"confidence":null}
{"run":94,"commit":"f81d9d6","metric":0,"metrics":{},"status":"keep","description":"Improved link-field error quality for a common wrong object shape by detecting {id: ...} on link fields and returning a schema-aware ValidationError that explains link fields expect a bare record ID string. On the same wrong-link-shape prompt, friction_count improved from 1 to 0.","timestamp":1774145142123,"segment":0,"confidence":null}
{"run":95,"commit":"f81d9d6","metric":0,"metrics":{},"status":"discard","description":"Probe: links-field wrong object shape ({id: ...} inside an array) is now already friction-free as a side effect of the link-shape error-quality improvement. No further change needed.","timestamp":1774145356038,"segment":0,"confidence":null}
{"run":96,"commit":"ad7c0df","metric":2,"metrics":{},"status":"checks_failed","description":"Baseline multi-step author+headshot+3-post workflow exposed two AX frictions: the seeded blog schema does not include an author headshot field, and `author` is a singleton model so a prompt phrased as 'create a new author' cannot actually create another author record. Claude worked around this by creating only the posts and omitting the requested author work. Benchmark friction_count was 2 / success 0, but checks are currently red on unrelated existing TypeScript typing issues in src/mcp/server.ts.","timestamp":1774179591457,"segment":0,"confidence":null}
{"run":97,"commit":"ad7c0df","metric":0,"metrics":{},"status":"checks_failed","description":"Aligned the bundled blog example schema with realistic multi-author editorial workflows: `author` is now a regular collection instead of a singleton, and it includes a `headshot` media field (plus matching example docs/schema export). On the same author+headshot+3-post workflow, friction_count improved from 2 / success 0 to 0 / success 1 because Claude could create the requested author, attach the imported headshot, create the three linked posts, and publish everything without detours. Checks still fail on unrelated existing TypeScript typing issues in src/mcp/server.ts, so the improvement cannot be kept yet.","timestamp":1774179910404,"segment":0,"confidence":null}
{"run":98,"commit":"21a3aa4","metric":0,"metrics":{},"status":"keep","description":"Hardened the bundled MCP/blog author workflow for realistic multi-author editing: the seeded `author` model is now a normal collection instead of a singleton, it includes a `headshot` media field, and the bundled prompt/schema docs were aligned to match. Also relaxed `withDecoded()` typing in src/mcp/server.ts so mixed-shape tool handlers compile cleanly and checks pass again. On the same author+headshot+3-post workflow, friction_count improved from 2 / success 0 to 0 / success 1 because Claude could create the requested author, attach the imported headshot, create the three linked posts, and publish everything without detours.","timestamp":1774180318592,"segment":0,"confidence":null}
{"run":99,"commit":"21a3aa4","metric":0,"metrics":{},"status":"discard","description":"Probe: bulk recovery flow (find three published posts, unpublish them, prefix titles with [DRAFT], leave as drafts) is already friction-free after the publish/unpublish and record update improvements. No AX change needed on this workflow.","timestamp":1774180586192,"segment":0,"confidence":null}
