{"type":"config","name":"Reduce friction and wheel-spinning in editor MCP UX","metricName":"friction_count","metricUnit":"","bestDirection":"lower"}
{"run":1,"commit":"a229780","metric":0,"metrics":{},"status":"crash","description":"Baseline run blocked immediately because CMS_WRITE_KEY was not set in the environment, so no MCP UX data could be gathered.","timestamp":1774104483133,"segment":0,"confidence":null}
{"run":2,"commit":"a229780","metric":2,"metrics":{},"status":"checks_failed","description":"Baseline editor task hit Claude's $0.50 budget ceiling before any MCP interaction, so the workflow failed with two friction points: hard stop and no recovery guidance. Existing unrelated test failures in autoresearch.checks.sh also blocked keeping any result.","timestamp":1774104797869,"segment":0,"confidence":null,"asi":{"hypothesis":"Measure baseline friction for a simple editor flow: read guide, create a post, publish it.","rollback_reason":"No code changes yet, and the run was invalid for UX iteration because the Claude subprocess exhausted its budget immediately.","next_action_hint":"Raise or remove the Claude budget cap in autoresearch.sh so simple editor tasks can complete and produce usable MCP UX traces.","failure_mode":"Exceeded USD budget (0.5) before any tool call","secondary_metrics":{"success":0},"checks_note":"Repository checks are currently red on existing sortable-tree tests unrelated to this experiment."}}
{"run":3,"commit":"a229780","metric":0,"metrics":{},"status":"checks_failed","description":"Fresh baseline tick after blog environment fix: simple guide→create→publish post flow completed cleanly with zero observed editor MCP friction, but repository checks are still red from unrelated existing test failures so no keep is possible.","timestamp":1774105446972,"segment":0,"confidence":null,"asi":{"hypothesis":"Now that the blog environment is fixed, rerun the simplest editorial workflow to establish a real baseline trace.","rollback_reason":"No code changes were made, and passing benchmark output cannot be kept while autoresearch.checks.sh is failing on unrelated pre-existing tests.","next_action_hint":"Move to a harder workflow that is more likely to expose editor MCP friction, since the basic post publish path is already friction-free.","secondary_metrics":{"success":1},"observed_behavior":"Claude completed the task in one clean pass and reported the created/published post ID.","checks_note":"sortable-tree tests remain failing outside the editor MCP surface."}}
{"run":4,"commit":"a229780","metric":0,"metrics":{},"status":"checks_failed","description":"Structured text workflow also completed cleanly: Claude inspected schema, built markdown-backed structured text with a code_block, created the post, and published it without visible wheel-spinning. Checks still fail on unrelated existing tests.","timestamp":1774105552407,"segment":0,"confidence":null,"asi":{"hypothesis":"A richer structured-text authoring task may surface guidance gaps around build_structured_text_from_markdown and block usage.","rollback_reason":"No editor-MCP code changes were made, and there was no friction reduction to keep anyway; repository checks remain red.","next_action_hint":"Escalate to a more failure-prone workflow such as assets, version restore, scheduling, or invalid input handling to find actual UX friction.","secondary_metrics":{"success":1},"observed_behavior":"Claude completed heading+paragraph+code_block authoring in one pass.","checks_note":"sortable-tree failures still block keep/discard decisions."}}
{"run":5,"commit":"a229780","metric":0,"metrics":{},"status":"checks_failed","description":"Improved the asset workflow by teaching import_asset_from_url to follow normal public redirects, clarifying guide/tool docs, and adding a cover_image field to the blog post schema. Re-running the same asset-import task dropped friction from 3 to 0 and succeeded end-to-end, but unrelated repository checks still failed so the improvement cannot be kept automatically.","timestamp":1774106026216,"segment":0,"confidence":null,"asi":{"hypothesis":"Asset workflow friction comes from redirect-hostile imports and schema/docs mismatch around post cover images; fixing those should remove wheel-spinning.","rollback_reason":"Benchmark improved, but autoresearch.checks.sh is still failing on unrelated existing tests, so keep is disallowed despite the UX win.","next_action_hint":"Fix the new/updated import redirect test and, if checks remain red from external work, continue gathering UX wins while noting they are blocked on unrelated check failures.","secondary_metrics":{"success":1},"improvement":{"from_friction_count":3,"to_friction_count":0},"changes_made":["src/services/asset-service.ts now follows validated public redirects during asset import","src/mcp/server.ts guide/tool text now nudges schema inspection and documents redirect-friendly asset imports","examples/blog/seed.ts now defines post.cover_image","live blog schema updated with post.cover_image via admin MCP"],"checks_note":"checks now report 6 failed tests / 667 passed; sortable-tree remains red and one MCP transport test likely needs updating for the redirect behavior change."}}
{"run":6,"commit":"a229780","metric":2,"metrics":{},"status":"checks_failed","description":"Nested block patching exposed real editor friction: Claude succeeded in patching by rewriting the parent feature_grid block, but discovered that patch_blocks only addresses top-level blocks and cannot target nested structured-text blocks directly.","timestamp":1774106225989,"segment":0,"confidence":null,"asi":{"hypothesis":"Complex nested structured-text edits will reveal whether patch_blocks is expressive enough for realistic editorial updates.","rollback_reason":"No code changes were made in this measurement run, and checks remain red anyway.","next_action_hint":"Improve patch_blocks docs/error guidance for nested blocks, or extend the tool to support nested structured-text field targeting so agents do not have to rewrite parent block payloads.","secondary_metrics":{"success":0},"observed_friction":["patch_blocks visibility is limited to top-level blocks","nested block edits require mental model discovery and workaround"],"learning":"Nested structured-text editing is a promising next optimization target because the current tool shape encourages wheel-spinning around block scope.","checks_note":"sortable-tree tests still failing unrelated to MCP UX."}}
{"run":7,"commit":"a229780","metric":0,"metrics":{},"status":"crash","description":"Reproducing nested structured-text patch friction was blocked immediately because run_experiment only allows invoking ./autoresearch.sh directly, and the benchmark process did not inherit CMS_WRITE_KEY in this context. No MCP UX data was gathered.","timestamp":1774106815816,"segment":0,"confidence":null}
{"run":8,"commit":"0b0eafd","metric":0,"metrics":{},"status":"crash","description":"Tried to run the editor MCP benchmark via dotenvx wrapper, but run_experiment rejected the command because autoresearch.sh must be invoked directly. Learned the harness enforces direct autoresearch.sh usage for this project.","timestamp":1774108965028,"segment":0,"confidence":null}
{"run":9,"commit":"0b0eafd","metric":2,"metrics":{},"status":"discard","description":"Baseline redirect-image editorial task exposed two UX frictions: import_asset_from_url rejects redirects, and the live blog schema lacks post.cover_image despite docs/examples implying it exists. No code changes yet; recorded baseline before fixing.","timestamp":1774109241254,"segment":0,"confidence":null}
{"run":10,"commit":"0b0eafd","metric":0,"metrics":{},"status":"checks_failed","description":"Followed public redirects in import_asset_from_url and added post.cover_image to the seed; the same redirect-image task dropped from friction_count 2 to 0, but checks failed because test/mcp-http-transport.test.ts still asserted redirects are rejected. Need to update tests for the new redirect-following behavior before keeping.","timestamp":1774109634696,"segment":0,"confidence":null}
{"run":11,"commit":"de0b8e6","metric":0,"metrics":{},"status":"keep","description":"Improved editor asset-import UX for the same redirect-image task: import_asset_from_url now follows safe public redirects, the guide/tool text says so, and the seeded blog schema now includes post.cover_image so the agent can attach the imported image directly. The benchmark went from friction_count 2 / success 0 to friction_count 0 / success 1 on the identical prompt.","timestamp":1774109990047,"segment":0,"confidence":null}
{"run":12,"commit":"de0b8e6","metric":1,"metrics":{},"status":"discard","description":"Baseline for a gallery + related-posts editorial workflow: Claude succeeded, but friction_count stayed at 1 because the seeded Post model was missing gallery and related_posts, so the session had to mutate schema before doing content work.","timestamp":1774110368298,"segment":0,"confidence":null}
{"run":13,"commit":"db8c77e","metric":0,"metrics":{},"status":"keep","description":"Improved multi-step editor workflow UX by adding related_posts and gallery to the seeded Post model. The same gallery + related-posts task dropped from friction_count 1 to 0 because Claude no longer had to detour into schema mutations before doing content work.","timestamp":1774110633744,"segment":0,"confidence":null}
{"run":14,"commit":"db8c77e","metric":0,"metrics":{},"status":"discard","description":"Baseline version-restore workflow was already friction-free: create, publish twice, list/restore the previous version, and re-publish all completed cleanly with friction_count 0, so no change to keep on this task.","timestamp":1774110871256,"segment":0,"confidence":null}
{"run":15,"commit":"db8c77e","metric":0,"metrics":{},"status":"discard","description":"Baseline nested structured-text workflow was already friction-free: Claude composed feature_grid → feature_card → nested code_block content, created the post, and published it with friction_count 0, so there was no improvement to keep.","timestamp":1774111168417,"segment":0,"confidence":null}
{"run":16,"commit":"20c3086","metric":0,"metrics":{},"status":"keep","description":"Clarified draft validation timing in the guide plus create_record/publish_record tool descriptions. On the same missing-required-field prompt, Claude went from friction_count 2 / success 0 with speculation to friction_count 0 / success 1, correctly reporting that draft creation succeeds and publish_record returns `Cannot publish: invalid fields: title (required)`.","timestamp":1774111718007,"segment":0,"confidence":null}
{"run":17,"commit":"20c3086","metric":0,"metrics":{},"status":"discard","description":"Baseline search workflow was already friction-free: Claude found the seeded post about vocabulary mismatch and explained why it matched, with friction_count 0, so there was no improvement to keep.","timestamp":1774111967557,"segment":0,"confidence":null}
{"run":18,"commit":"20c3086","metric":2,"metrics":{},"status":"discard","description":"Tried reducing editor/admin boundary confusion by documenting in the guide that schema-mutation tools are absent on /mcp/editor and require switching to admin MCP. The benchmark still scored friction_count 2 because the prompt asked for an exact runtime error, but tool omission means there is no CMS-level error to surface.","timestamp":1774112490128,"segment":0,"confidence":null}
{"run":19,"commit":"20c3086","metric":0,"metrics":{},"status":"discard","description":"Baseline asset-metadata workflow was already friction-free: Claude imported an image with alt/title, attached it to cover_image, and confirmed the metadata was preserved with friction_count 0, so there was no improvement to keep.","timestamp":1774112752511,"segment":0,"confidence":null}
{"run":20,"commit":"7a5892d","metric":0,"metrics":{},"status":"keep","description":"Improved invalid-link error quality by validating link/links references during create/update instead of silently accepting dangling IDs. On the same broken-author-reference prompt, Claude went from friction_count 1 to 0 and now reports a precise ValidationError: `Linked record(s) not found for field 'author': 01NONEXISTENTAUTHOR0000000000`.","timestamp":1774113756972,"segment":0,"confidence":null}
{"run":21,"commit":"7a5892d","metric":0,"metrics":{},"status":"discard","description":"Baseline schedule-publish workflow was already friction-free: create, schedule, verify, clear, and confirm removal all completed cleanly with friction_count 0, so there was no improvement to keep.","timestamp":1774113990614,"segment":0,"confidence":null}
{"run":22,"commit":"7a5892d","metric":0,"metrics":{},"status":"discard","description":"Baseline invalid-block-type edge case was already friction-free: Claude got a precise ValidationError listing the disallowed block type and the allowed block types for content, so there was no improvement to keep.","timestamp":1774114242229,"segment":0,"confidence":null}
{"run":23,"commit":"7a5892d","metric":0,"metrics":{},"status":"checks_failed","description":"Tried a harder multi-step editorial workflow ('write and publish a post about Effect TypeScript') as a fresh probe. The benchmark itself was friction-free, but project checks failed due to unrelated working-tree/typecheck issues already present in files like src/services/* and package metadata, so this run cannot be kept.","timestamp":1774114490098,"segment":0,"confidence":null}
{"run":24,"commit":"7a5892d","metric":0,"metrics":{},"status":"checks_failed","description":"Probed a nested patch_blocks editorial workflow; the benchmark itself was friction-free, but checks failed due to an unrelated existing localization test failure, so this run cannot be kept.","timestamp":1774114786700,"segment":0,"confidence":null}
{"run":25,"commit":"7a5892d","metric":0,"metrics":{},"status":"checks_failed","description":"Ran a cleanup probe benchmark to force a revert cycle; benchmark itself was friction-free, but checks are still failing on an unrelated localization regression in the current branch, so this cannot be kept.","timestamp":1774115291846,"segment":0,"confidence":null}
{"run":26,"commit":"a250df8","metric":2,"metrics":{},"status":"keep","description":"Improved script-writing/editor HTTP UX by documenting MCP surface boundaries plus raw HTTP/JSON-RPC usage in the guide: admin vs editor endpoints, bearer auth, tools/call wire format, and result payload shape. On the same curl-script prompt, friction_count improved from 3 to 2 and Claude no longer had to speculate about the endpoint/protocol basics.","timestamp":1774115629273,"segment":0,"confidence":null}
{"run":27,"commit":"a250df8","metric":4,"metrics":{},"status":"checks_failed","description":"Tried refining the guide to mention nested mount points like /cms/mcp, but on the same curl-script prompt friction got worse: Claude started inferring extra protocol details (session headers, SSE envelopes) and spent more turns explaining them. Checks also failed due to an unrelated localization regression, so this cannot be kept.","timestamp":1774115995626,"segment":0,"confidence":null}
{"run":28,"commit":"a250df8","metric":1,"metrics":{},"status":"checks_failed","description":"Clarified in the guide/tool descriptions that singleton content models (like a site_settings record with tagline) should be handled via query_records/update_record, while get_site_settings/update_site_settings target the built-in global table. On the same site-settings prompt, friction improved from 2 to 1, but checks still failed due to the unrelated localization regression, so this cannot be kept yet.","timestamp":1774116509404,"segment":0,"confidence":null}
{"run":29,"commit":"7a3e0ef","metric":1,"metrics":{},"status":"keep","description":"Improved site-settings/editor UX by clarifying that get_site_settings/update_site_settings target the built-in global site_settings table, while singleton content models like site_settings-with-tagline should be updated via query_records/update_record. Also fixed localization tests to stop depending on ID ordering after the new short-ID generation change. On the same site-settings prompt, friction_count improved from 2 to 1 and checks now pass again.","timestamp":1774116950236,"segment":0,"confidence":null}
{"run":30,"commit":"851f782","metric":0,"metrics":{},"status":"keep","description":"Added a dedicated update_singleton_record editor tool and strengthened singleton/global site-settings guidance, so agents no longer have to route singleton edits through generic record plumbing or the misleading global settings tool. Also fixed localization tests to be robust with the new short-ID generator. On the same site-settings-singleton prompt, friction_count improved from 2 to 0.","timestamp":1774117956584,"segment":0,"confidence":null}
{"run":31,"commit":"851f782","metric":0,"metrics":{},"status":"discard","description":"Baseline all-field content creation workflow was already friction-free: Claude imported an image, linked existing records, filled composite fields correctly, built structured_text, and published the post with friction_count 0, so there was no improvement to keep.","timestamp":1774118463666,"segment":0,"confidence":null}
{"run":32,"commit":"851f782","metric":2,"metrics":{},"status":"discard","description":"Discarded this duplication probe because the prompt targeted a non-existent seeded post title ('The Agent-First CMS'), so the measured friction was about benchmark/schema mismatch rather than MCP UX.","timestamp":1774118732821,"segment":0,"confidence":null}
{"run":33,"commit":"851f782","metric":0,"metrics":{},"status":"discard","description":"Baseline duplication workflow for an actual seeded post was already friction-free: Claude copied the published post into a new record, adjusted the title/slug, and published it with friction_count 0, so there was no improvement to keep.","timestamp":1774118987147,"segment":0,"confidence":null}
{"run":34,"commit":"851f782","metric":0,"metrics":{},"status":"discard","description":"Baseline 'undo last change' workflow was already friction-free: Claude restored the previous version and re-published successfully with friction_count 0, so there was no improvement to keep.","timestamp":1774119295025,"segment":0,"confidence":null}
{"run":35,"commit":"851f782","metric":0,"metrics":{},"status":"discard","description":"Baseline preview-style workflow was already friction-free: Claude compared the draft excerpt with the published excerpt via current record state plus _published_snapshot, so there was no improvement to keep.","timestamp":1774119535944,"segment":0,"confidence":null}
{"run":36,"commit":"851f782","metric":0,"metrics":{},"status":"discard","description":"Baseline bulk-create workflow was already friction-free: Claude used bulk_create_records to create and verify five categories with generated slugs and sort orders, so there was no improvement to keep.","timestamp":1774119826810,"segment":0,"confidence":null}
{"run":37,"commit":"851f782","metric":0,"metrics":{},"status":"discard","description":"Baseline create-publish-delete workflow was already friction-free: Claude created, published, deleted, and verified removal of a post with friction_count 0, so there was no improvement to keep.","timestamp":1774120075448,"segment":0,"confidence":null}
{"run":38,"commit":"851f782","metric":2,"metrics":{},"status":"discard","description":"Tried tightening the guide for curl/JSON-RPC scripts with mount-point, token reuse, and jq extraction guidance, but the script-writing benchmark stayed at friction_count 2. Remaining friction is mostly inherent auth/bootstrap inference outside the MCP surface rather than wording alone.","timestamp":1774120429971,"segment":0,"confidence":null}
{"run":39,"commit":"6ccfa7e","metric":0,"metrics":{},"status":"keep","description":"Added bulk_publish_records to the editor MCP and documented it in the guide. On the same three-post publishing workflow, friction_count improved from 1 to 0 because Claude could publish all records in one call instead of looping over publish_record.","timestamp":1774121060886,"segment":0,"confidence":null}
{"run":40,"commit":"6ccfa7e","metric":1,"metrics":{},"status":"discard","description":"Baseline for multi-record unpublish workflow found one remaining friction point: no bulk_unpublish_records tool exists, so Claude had to parallelize unpublish_record calls manually.","timestamp":1774121339343,"segment":0,"confidence":null}
{"run":41,"commit":"2fe36cc","metric":0,"metrics":{},"status":"keep","description":"Added bulk_unpublish_records to the editor MCP and documented it in the guide. On the same three-post unpublish workflow, friction_count improved from 1 to 0 because Claude could unpublish all records in one call instead of parallelizing unpublish_record manually.","timestamp":1774121699633,"segment":0,"confidence":null}
{"run":42,"commit":"2fe36cc","metric":2,"metrics":{},"status":"discard","description":"Re-probed the editor/admin boundary after prior guide improvements. Friction remains at 2 because schema tools are intentionally absent on the editor surface, so there is still no runtime error to surface—just tool omission plus guidance to switch to admin MCP.","timestamp":1774121940483,"segment":0,"confidence":null}
{"run":43,"commit":"2fe36cc","metric":2,"metrics":{},"status":"discard","description":"Baseline Node.js MCP scripting workflow still has friction_count 2: Claude can produce a workable script, but it still has to infer auth/bootstrap details and the exact post field names because the guide doesn’t strongly enough direct script authors to inspect schema_info/describe_model first.","timestamp":1774122223810,"segment":0,"confidence":null}
